{
  "schemaVersion": 1,
  "kind": "codaro.reference-products",
  "products": [
    {
      "id": "browser-calculator",
      "title": "반응형 견적 계산기",
      "sourcePath": "examples/apps/browser-calculator/app.py",
      "runtimeTarget": "browser",
      "entryBlockIds": ["price-widget", "quantity-widget", "total-view"],
      "assetPaths": [],
      "secretRefs": [],
      "journey": {
        "plainPython": true,
        "publicSdkImports": ["ui"],
        "appProjection": true,
        "embedModes": ["output", "interactive", "editable"],
        "publicationSteps": ["build", "serve", "embed", "deploy"],
        "proofKinds": ["sourceRevision", "buildArtifact", "deployment"],
        "claimBoundary": "machineVerified"
      },
      "claim": "브라우저에서 입력을 바꾸면 dependency closure만 다시 계산되는 앱을 만든다."
    },
    {
      "id": "csv-dashboard",
      "title": "CSV 지역 매출 대시보드",
      "sourcePath": "examples/apps/csv-dashboard/app.py",
      "runtimeTarget": "browser",
      "entryBlockIds": ["region-widget", "summary-view"],
      "assetPaths": ["examples/apps/csv-dashboard/data/sales.csv"],
      "secretRefs": [],
      "journey": {
        "plainPython": true,
        "publicSdkImports": ["ui"],
        "appProjection": true,
        "embedModes": [],
        "publicationSteps": ["build", "serve", "deploy"],
        "proofKinds": ["sourceRevision", "buildArtifact", "deployment"],
        "claimBoundary": "machineVerified"
      },
      "claim": "검증된 CSV snapshot과 필터 입력을 함께 담은 정적 대시보드를 만든다."
    },
    {
      "id": "snapshot-report",
      "title": "운영 상태 snapshot 보고서",
      "sourcePath": "examples/apps/snapshot-report/app.py",
      "runtimeTarget": "browser",
      "entryBlockIds": ["report-view"],
      "assetPaths": ["examples/apps/snapshot-report/data/status.json"],
      "secretRefs": [],
      "journey": {
        "plainPython": true,
        "publicSdkImports": ["hstack", "stat"],
        "appProjection": true,
        "embedModes": [],
        "publicationSteps": ["build", "serve", "deploy"],
        "proofKinds": ["sourceRevision", "buildArtifact", "deployment"],
        "claimBoundary": "machineVerified"
      },
      "claim": "생성 시각과 source hash가 고정된 데이터를 외부 요청 없는 보고서로 만든다."
    },
    {
      "id": "server-secret-app",
      "title": "Secret 참조 서버 상태 앱",
      "sourcePath": "examples/apps/server-secret-app/app.py",
      "runtimeTarget": "server",
      "entryBlockIds": ["request-widget", "server-result"],
      "assetPaths": [],
      "secretRefs": ["REFERENCE_API_TOKEN"],
      "journey": {
        "plainPython": true,
        "publicSdkImports": ["ui"],
        "appProjection": true,
        "embedModes": [],
        "publicationSteps": ["build", "serve", "deploy"],
        "proofKinds": ["sourceRevision", "buildArtifact", "deployment"],
        "claimBoundary": "machineVerified"
      },
      "claim": "Secret 값을 client bundle에 넣지 않는 session 격리 서버 앱을 만든다."
    },
    {
      "id": "local-file-automation",
      "title": "재고 파일 자동화 대시보드",
      "sourcePath": "examples/apps/local-file-automation/app.py",
      "runtimeTarget": "local",
      "entryBlockIds": ["automation-run"],
      "assetPaths": ["examples/apps/local-file-automation/data/inventory.csv"],
      "secretRefs": [],
      "journey": {
        "plainPython": true,
        "publicSdkImports": [],
        "appProjection": true,
        "embedModes": [],
        "publicationSteps": ["build", "serve", "rollback"],
        "proofKinds": [],
        "claimBoundary": "machineVerified"
      },
      "claim": "명시한 파일과 process 권한으로 재실행 가능한 immutable 로컬 앱을 만든다."
    }
  ],
  "claimBoundary": {
    "machineVerified": [
      "평범한 Percent Python reference source의 plain Python 실행, compiler target과 app projection",
      "같은 source의 browser, server, local 전체 앱 publication과 계산기 기능 블록 embed",
      "output, interactive, editable embed의 entry closure, widget 상태, origin과 protocol 거부",
      "localhost와 LAN에서 검증 가능한 immutable browser, server, local bundle",
      "content hash가 연결된 build, operational, deployment receipt와 rollback",
      "strong learning evidence에서 동일 source 기능 블록, 의미 검증 Task와 operational proof 승격",
      "provider 없이 생성 가능한 folder, ZIP, self-host 산출물",
      "built wheel을 빈 환경에 설치한 public Python SDK와 CLI"
    ],
    "notVerified": [
      "공용 인터넷 URL의 uptime, DNS, TLS",
      "인간 학습 효과의 인과 검증",
      "외부 provider의 서비스 지속성",
      "브라우저 bundle 속 Python source의 비공개성과 hideCode의 보안성",
      "shared app state의 동시 사용자 일관성",
      "범용 debugger, source control UI, extension marketplace를 포함한 범용 IDE 전체"
    ]
  }
}
